,Text,Star,Compound Value,Cleaned_Text
0,Unable to update won't load crashing at times unresponsive was a good reliable app now it's unreliable,1,0.765,unable to update won t load crashing at times unresponsive was a good reliable app now it s unreliable
1,Good,1,0.4404,good
2,Good,1,0.4404,good
3,Z be l nook look t mm vmll and as aaàafjio cft KK Ann t z g,1,0.6705,z be l nook look t mm vmll and as aa afjio cft kk ann t z g
4,It is the best app for browsing,1,0.6369,it is the best app for browsing
5,"Dark mode is acting up and changing screen light to super bright on it's own , super annoyed",1,0.8442,dark mode is acting up and changing screen light to super bright on it s own   super annoyed
6,"Latest update turns my screen pink on some web pages I keep uninstalling the latest updates as it seems to be the cause. Please Google sort it out, also does it on smart assistant on my oppo Reno 2",1,0.6124,latest update turns my screen pink on some web pages i keep uninstalling the latest updates as it seems to be the cause  please google sort it out  also does it on smart assistant on my oppo reno  
7,Best,1,0.6369,best
8,Good,1,0.4404,good
9,Nice,1,0.4215,nice
10,Chorme is best but without my permission it opening some web sites . When I'm playing the games like its opening some websites and when i 'm using whatsapp its opening.when I'm power on its showing again and again.So please fix its by giving some update,1,0.9341,chorme is best but without my permission it opening some web sites   when i m playing the games like its opening some websites and when i  m using whatsapp its opening when i m power on its showing again and again so please fix its by giving some update
11,Good😊,1,0.4404,good 
12,Good,1,0.4404,good
13,Good,1,0.4404,good
14,This app was using all my data for the month in a week. Changed to a different browser that uses way less data to view web pages. Now I don't have to upgrade my cell plan. Extra bonus the pages load faster on my new browser,1,0.5423,this app was using all my data for the month in a week  changed to a different browser that uses way less data to view web pages  now i don t have to upgrade my cell plan  extra bonus the pages load faster on my new browser
15,"Why won't you let me install a backedup version of the app?!? I normally update the app on my on schedule (every two months). But the app kept nagging me to update it. Now the app freezes, locks up and is non-responsive multiple times within the hour. This is happening on my Google Pixel 2 and on my Samsung Tab S2. I will be sure NOT to upgrade the app whenever it suggests that I do so. This is why I don't allow automatic updates... This is some BS...",1,0.7351,why won t you let me install a backedup version of the app    i normally update the app on my on schedule  every two months   but the app kept nagging me to update it  now the app freezes  locks up and is non responsive multiple times within the hour  this is happening on my google pixel   and on my samsung tab s   i will be sure not to upgrade the app whenever it suggests that i do so  this is why i don t allow automatic updates    this is some bs   
16,"If you value freedom and liberty, switch to duckduckgo. Google uses its enormous power to destroy western culture and philosophy and it sticks its middle finger up at your privacy !",1,0.738,if you value freedom and liberty  switch to duckduckgo  google uses its enormous power to destroy western culture and philosophy and it sticks its middle finger up at your privacy  
17,IT IS GOOD FOR GAMING,1,0.4404,it is good for gaming
18,"I face so many problems from my Chrome application. It is not working as well, so please solve my Chrome mobile application as soon as possible. Thanks",1,0.49,i face so many problems from my chrome application  it is not working as well  so please solve my chrome mobile application as soon as possible  thanks
19,"Recently running incredibly slow despite only one or two active tabs. It's occasionally been claiming that I am offline despite other internet connected apps working fine. Updates close your incognito tabs, which is rather annoying. *Upon changing to a 1 star review suddenly now Google cares, it seems.",1,0.5106,recently running incredibly slow despite only one or two active tabs  it s occasionally been claiming that i am offline despite other internet connected apps working fine  updates close your incognito tabs  which is rather annoying   upon changing to a 1 star review suddenly now google cares  it seems 
20,Doing very well only about a week it started malfunctioning like opening a site and logging in to my account on the site would be impossible!; I also tried updating the app it started with downloading the update up to 100% and started all over again until my internet plan was exhausted. pls fix this asap 🙏,1,0.4005,doing very well only about a week it started malfunctioning like opening a site and logging in to my account on the site would be impossible   i also tried updating the app it started with downloading the update up to 100  and started all over again until my internet plan was exhausted  pls fix this asap  
21,Won't updated,1,0.5719,won t updated
22,What's going on???... My chrome won't load and automatically shuts down!,1,0.5719,what s going on       my chrome won t load and automatically shuts down 
23,This file sharing for third person,1,0.4215,this file sharing for third person
24,"The update won't download, and from the other reviews it's probably a good thing!",1,0.765,the update won t download  and from the other reviews it s probably a good thing 
25,It won't let me update app..plus its running slower now🤔,1,0.5719,it won t let me update app  plus its running slower now 
26,Good,1,0.4404,good
27,Chrome won't update I got a new phone and nothing has changed someone fix this,1,0.5719,chrome won t update i got a new phone and nothing has changed someone fix this
28,"Hate it, I have been using the Google search widget for years, I click the microphone and talk, its been good just a beep letting me know its ready, now I click the microphone and I hear ""WHAT WOULD YOU LIKE TO SEARCH FOR....BEEP"" I DO NOT NEED TO BE ASKED ANYTHING.... ""WHAT WOULD YOU LIKE TO SEARCH FOR....BEEP"" ""WHAT WOULD YOU LIKE TO SEARCH FOR....BEEP"" ""WHAT WOULD YOU LIKE TO SEARCH FOR....BEEP"" ""WHAT WOULD YOU LIKE TO SEARCH FOR....BEEP"" ""WHAT WOULD YOU LIKE TO SEARCH FOR....BEEP""",1,0.9287,hate it  i have been using the google search widget for years  i click the microphone and talk  its been good just a beep letting me know its ready  now i click the microphone and i hear  what would you like to search for    beep  i do not need to be asked anything      what would you like to search for    beep   what would you like to search for    beep   what would you like to search for    beep   what would you like to search for    beep   what would you like to search for    beep 
29,Good serving,1,0.4404,good serving
30,Excellent,1,0.5719,excellent
31,It won't update properly and that causes issues,1,0.5719,it won t update properly and that causes issues
32,"Keeps stopping, won't update!",1,0.4767,keeps stopping  won t update 
33,My chrome app not update in my phone.why ? Please help,1,0.6124,my chrome app not update in my phone why   please help
34,Won't let me update.,1,0.5719,won t let me update 
35,After new update won't load,1,0.5719,after new update won t load
36,Good on searching not on updating and installing,1,0.4404,good on searching not on updating and installing
37,Hi google. My xiaomi note 9s cant seem to update. Cn you help?,1,0.4019,hi google  my xiaomi note  s cant seem to update  cn you help 
38,Nice n fast,1,0.4215,nice n fast
39,"I've always been atracted to Crome but now I've just about had it with Crome. You people always cancle a persons download just when it has gone far. Data is not easy to come by this days, you know. And u don't even give free data like Opramini. Too many ads that comsumes data. Crome is stating to look like a fraud app to me. Please fix this before or Crome users will stop using Crome giving that now we have so many browsing apps.",1,0.7087,i ve always been atracted to crome but now i ve just about had it with crome  you people always cancle a persons download just when it has gone far  data is not easy to come by this days  you know  and u don t even give free data like opramini  too many ads that comsumes data  crome is stating to look like a fraud app to me  please fix this before or crome users will stop using crome giving that now we have so many browsing apps 
40,Good,1,0.4404,good
41,Haven't been able to update for weeks now on my s10. Finally was able to update awhile back and now a new update I ve been trying for weeks now won't update again. Gona start using a different browser even alot of sights ive visited especially when trying to make purchases suggest using something g other than chrome.,1,0.5719,haven t been able to update for weeks now on my s10  finally was able to update awhile back and now a new update i ve been trying for weeks now won t update again  gona start using a different browser even alot of sights ive visited especially when trying to make purchases suggest using something g other than chrome 
42,Won't even update. This is why I use Firefox.,1,0.5719,won t even update  this is why i use firefox 
43,Won't update,1,0.5719,won t update
44,Won't let me update,1,0.5719,won t let me update
45,I can't update this app. I hit update and it doesn't do anything. My phone has been crashing and running slow. I started using Duck Duck Go as my browser and have had better luck.,1,0.7096,i can t update this app  i hit update and it doesn t do anything  my phone has been crashing and running slow  i started using duck duck go as my browser and have had better luck 
46,Nice,1,0.4215,nice
47,All free ads pop up,1,0.5106,all free ads pop up
48,Won't update,1,0.5719,won t update
49,Won't update,1,0.5719,won t update
50,A lil terrible but if you do know how to fix this please fix it. The thing is when i open something to download inside of chrome it shows ads. And its bothering me from the view. If you know how to fix this please kindly fix it.,1,0.7734,a lil terrible but if you do know how to fix this please fix it  the thing is when i open something to download inside of chrome it shows ads  and its bothering me from the view  if you know how to fix this please kindly fix it 
51,The dog gone app won't even update..what does that tell you...nothing but problems! If I could give it zero(0) stars.. thats what this app deserves! They don't even read these comments or try to fix the bugs...grr!,1,0.6413,the dog gone app won t even update  what does that tell you   nothing but problems  if i could give it zero 0  stars   thats what this app deserves  they don t even read these comments or try to fix the bugs   grr 
52,Good,1,0.4404,good
53,Best app,1,0.6369,best app
54,Worked great until I updated and now I can't even open it. Way to go! How long until this is fixed and we can search things?,1,0.6249,worked great until i updated and now i can t even open it  way to go  how long until this is fixed and we can search things 
55,"I've always been a fan of google and chrome for almost ever but now I'm not so sure. Ever since the update my chrome either won't load, force closes, gives me the unresponsive message, or takes entirely too long to load especially looking up google flights!! Google needs to fix whatever bugs and discrepencies there are ASAP because this is complete Bull****!!",1,0.5407,i ve always been a fan of google and chrome for almost ever but now i m not so sure  ever since the update my chrome either won t load  force closes  gives me the unresponsive message  or takes entirely too long to load especially looking up google flights   google needs to fix whatever bugs and discrepencies there are asap because this is complete bull      
56,Chrome has been wonderful over the years for me but for some reason the app will not update. I cleared out all my cache and storage and it's still not updating. I don't know why !!!!! Can please some one help me!!!!!!!!!!,1,0.8129,chrome has been wonderful over the years for me but for some reason the app will not update  i cleared out all my cache and storage and it s still not updating  i don t know why       can please some one help me          
57,Sir I unable to update this app Sir please help me to update it,1,0.6124,sir i unable to update this app sir please help me to update it
58,I wish i didnt update.,1,0.4019,i wish i didnt update 
59,Great,1,0.6249,great
60,I don't want my business shared with anyone. I have been violated. I want sharing my information off. Please clear sharing with everyone.,1,0.8442,i don t want my business shared with anyone  i have been violated  i want sharing my information off  please clear sharing with everyone 
61,"This app will not update. So I'm gonna uninstall and download a better web bro see l tellwser. Let's hope that it does automatic updates, is safe and especially reliable. Google being one of the biggest Tech Giants today, we would at least think that the app would not of been this long without being fixed. Another reason I'm uninstalling is because of the length of time I have gotten linked back to the play store to update the app that simply won't do anything you can not even open the app.",1,0.9501,this app will not update  so i m gonna uninstall and download a better web bro see l tellwser  let s hope that it does automatic updates  is safe and especially reliable  google being one of the biggest tech giants today  we would at least think that the app would not of been this long without being fixed  another reason i m uninstalling is because of the length of time i have gotten linked back to the play store to update the app that simply won t do anything you can not even open the app 
62,Won't let me update the app. Goes to pending and just stops.,1,0.4767,won t let me update the app  goes to pending and just stops 
63,Good,1,0.4404,good
64,This app not updated yet I already trying again and again but not updated poor service,1,0.5157,this app not updated yet i already trying again and again but not updated poor service
65,Won't let me update,1,0.5719,won t let me update
66,super,1,0.5994,super
67,Nice,1,0.4215,nice
68,Is fast secure I love it,1,0.765,is fast secure i love it
69,Good,1,0.4404,good
70,Won't update. Ever.,1,0.5719,won t update  ever 
71,Honestly if I could give it less I would. Cant even searcg anything after the update,1,0.4588,honestly if i could give it less i would  cant even searcg anything after the update
72,"When I try to update this app It doesn't allow me to. Well, I don't think it's my phone's fault. I clean the cache and couldn't uninstall to install back. Is there any way I can update this app?",1,0.4588,when i try to update this app it doesn t allow me to  well  i don t think it s my phone s fault  i clean the cache and couldn t uninstall to install back  is there any way i can update this app 
73,Its constantly showing clean phone after i cleaned it,1,0.4019,its constantly showing clean phone after i cleaned it
74,"Does not work no matter what i do! Just forces close every f-ing time, and updating doesn't help",1,0.4127,does not work no matter what i do  just forces close every f ing time  and updating doesn t help
75,Won't update and can't use it much and it's the only browser I have and use please fix this,1,0.7184,won t update and can t use it much and it s the only browser i have and use please fix this
76,Trying to update chrome for over a week now and it refuses to update...it is 2 months now still can't update...I've given up and moved to DUCKDUCKGO....MUCH BETTER quick for loading and best for privacy...won't be going back to Google Chrome,1,0.8957,trying to update chrome for over a week now and it refuses to update   it is   months now still can t update   i ve given up and moved to duckduckgo    much better quick for loading and best for privacy   won t be going back to google chrome
77,Won't load any page and won't allow me to update it,1,0.8519,won t load any page and won t allow me to update it
78,Its not responding to my request when I am searching or visiting a link. Please fix this. Thanks.,1,0.6369,its not responding to my request when i am searching or visiting a link  please fix this  thanks 
79,"Always have to download updates from apkmirror, update from here crashes chrome! Update: Bromite is so much better, comes with ad-blocker too.",1,0.4902,always have to download updates from apkmirror  update from here crashes chrome  update  bromite is so much better  comes with ad blocker too 
80,The app won't load anything and then it crashes and goes back to the home screen. Why?,1,0.5719,the app won t load anything and then it crashes and goes back to the home screen  why 
81,t Thanks again Vietta how's your car doing well I hope you have a great day and I will be able and willing to help you out with the next steps for me to do that we need to get the update on the status of the order I placed the order on your way back to the office I will send you my email address to use it for you if you need anything else from me please let me know what you need from me to get you a copy of the order I placed the right number for you to call for the next couple weeks so I'm goi.,1,0.946,t thanks again vietta how s your car doing well i hope you have a great day and i will be able and willing to help you out with the next steps for me to do that we need to get the update on the status of the order i placed the order on your way back to the office i will send you my email address to use it for you if you need anything else from me please let me know what you need from me to get you a copy of the order i placed the right number for you to call for the next couple weeks so i m goi 
82,Google isn't safe,1,0.4404,google isn t safe
83,Good,1,0.4404,good
84,Please help me chrome team Google chrome new update is showing in play store when I click on update the app is not updating please help me 🙏🙏🙏,1,0.4905,please help me chrome team google chrome new update is showing in play store when i click on update the app is not updating please help me    
85,Chrome is not getting update i have click on update button but it get canceled immediately i have tried many times but same is happening. Please fix this!!,1,0.4497,chrome is not getting update i have click on update button but it get canceled immediately i have tried many times but same is happening  please fix this  
86,Unable to update the application on Samsung tab a. Please help Google developer,1,0.6124,unable to update the application on samsung tab a  please help google developer
87,I updated just before 5 mins and its keep crashing. It freezes on startup and not able to any thing. It shows internet connection issue but on other side am getting continuous emails. Please fix.,1,0.4404,i updated just before   mins and its keep crashing  it freezes on startup and not able to any thing  it shows internet connection issue but on other side am getting continuous emails  please fix 
88,It keeps asking me to update Google Chrome and when I try it won't allow it.,1,0.6808,it keeps asking me to update google chrome and when i try it won t allow it 
89,Best app ever,1,0.6369,best app ever
90,This is to bring to your notice to an urgent solution for updating the the chrome app in my mobile handset.  I am not able to update the chrome app through play store after continuously trying for several times.  Please provide an urgent solution for the same.  Thank you,1,0.9081,this is to bring to your notice to an urgent solution for updating the the chrome app in my mobile handset   i am not able to update the chrome app through play store after continuously trying for several times   please provide an urgent solution for the same   thank you
91,It says there is an update? But it will NOT UPDATE.... no matter what I do? What's going on Google? I rely on Google Chrome as my #1 Search.... Please get this FIXED!,1,0.4646,it says there is an update  but it will not update     no matter what i do  what s going on google  i rely on google chrome as my  1 search     please get this fixed 
92,Nice,1,0.4215,nice
93,"It won't let me use Google chrome without updating the app, but then it won't let me update it! PLEASE FIX THIS ASAP!!",1,0.8847,it won t let me use google chrome without updating the app  but then it won t let me update it  please fix this asap  
94,It won't update.,1,0.5719,it won t update 
95,Nit abke to update... Tried more than 100 times Can somebody help,1,0.4019,nit abke to update    tried more than 100 times can somebody help
96,Still isn't lóadíng data,1,0.4588,still isn t l ad ng data
97,Unable to update on my oppo a9 2020. I uninstalled previous updates and tried to clear all data cache of google play store and chrome. Still it is not updating.,1,0.6124,unable to update on my oppo a   0 0  i uninstalled previous updates and tried to clear all data cache of google play store and chrome  still it is not updating 
98,Good,1,0.4404,good
99,Please update my Google Chrome app Please help,1,0.743,please update my google chrome app please help
100,"What the heck happened to Google Chrome???!!! It used to be awesome just two days ago, and now it seems like a trash. I can't update it or download anything by using it. Please fix this early so that it can be useful like it before...",1,0.9231,what the heck happened to google chrome       it used to be awesome just two days ago  and now it seems like a trash  i can t update it or download anything by using it  please fix this early so that it can be useful like it before   
101,I can't get out of here! Help!🥺🙄,1,0.4019,i can t get out of here  help   
102,I cannot update the chrome. It has some issues. Please resolve it for me.,1,0.5994,i cannot update the chrome  it has some issues  please resolve it for me 
103,I cant even update the app on my phone how funny is that. Everytime i hit update it starts and stops instantly. What a Joke.,1,0.5423,i cant even update the app on my phone how funny is that  everytime i hit update it starts and stops instantly  what a joke 
104,Great,1,0.6249,great
105,He is a good app,1,0.4404,he is a good app
106,"Won't run crashes on startup, excellent testing there 🤔",1,0.8126,won t run crashes on startup  excellent testing there  
107,Won't update android 10,1,0.5719,won t update android 10
108,Not able to update this application .. pls help..,1,0.4588,not able to update this application    pls help  
109,Good,1,0.4404,good
110,Won't update,1,0.5719,won t update
111,So good,1,0.4927,so good
112,"I don't have mobile good enough to use it, means it is not running in my mobile properly so I've given 1star",1,0.4404,i don t have mobile good enough to use it  means it is not running in my mobile properly so i ve given 1star
113,The app won't update,1,0.5719,the app won t update
114,Good,1,0.4404,good
115,It won't let me update this app,1,0.5719,it won t let me update this app
116,"Used to be a good but it won't update now so it doesn't work properly because it will not update! Even though everytime I open the app it tells me to update but when I click on update it says ""pending"" then stops....?",1,0.7269,used to be a good but it won t update now so it doesn t work properly because it will not update  even though everytime i open the app it tells me to update but when i click on update it says  pending  then stops     
117,Best app ever,1,0.6369,best app ever
118,Why can't I update? It keeps telling me to update but the updates just won't update... Please fix. This has been an issue since December 2020!!!,1,0.8402,why can t i update  it keeps telling me to update but the updates just won t update    please fix  this has been an issue since december  0 0   
119,Google has tracked my every move on line and offline sending me ads for text I have sent to friends like I need a oil change bro then boom when I get online I got advertisements trying to sell me oil changes. I have told friend in chat about a certain boot I wanna get boom the brand and the exact model is on my page. They have censored my search history to what I wanna look for they shift me going another way scary site stay away no good,1,0.4929,google has tracked my every move on line and offline sending me ads for text i have sent to friends like i need a oil change bro then boom when i get online i got advertisements trying to sell me oil changes  i have told friend in chat about a certain boot i wanna get boom the brand and the exact model is on my page  they have censored my search history to what i wanna look for they shift me going another way scary site stay away no good
120,"Won't update, cannot get the update to work. Tried on wifi and mobile data nothing worked. Used to be an awesome browser but if I can't update it then security falls below standard and my information is at risk. Fix this asap.",1,0.6542,won t update  cannot get the update to work  tried on wifi and mobile data nothing worked  used to be an awesome browser but if i can t update it then security falls below standard and my information is at risk  fix this asap 
121,Good,1,0.4404,good
122,Good App,1,0.4404,good app
123,Good,1,0.4404,good
124,"Its not possible for me to update my google Crome, since i have purchased my phone.can you please find a solution for this issue.",1,0.5574,its not possible for me to update my google crome  since i have purchased my phone can you please find a solution for this issue 
