,Text,Star,Compound Value,Cleaned_Text
271,"Worked just as desired until the update that forced tab groups. I don't want or need groups, so please give us the option of doing this instead of forcing it on us. At least give me the option to open a link into the same tab group. Why does it only give the option to open in a new group?! Google chrome? More like Google fail. Looks like it's back to Firefox until this gets resolved again.",1,0.5604,worked just as desired until the update that forced tab groups  i don t want or need groups  so please give us the option of doing this instead of forcing it on us  at least give me the option to open a link into the same tab group  why does it only give the option to open in a new group   google chrome  more like google fail  looks like it s back to firefox until this gets resolved again 
272,I am unable to update it ..tried many times but same result .kindly help me out,1,0.8338,i am unable to update it   tried many times but same result  kindly help me out
273,"Buggy as of Feb 2021. Many sites don't work or the app freezes. Took away desktop mode before you ask for a web page when adding a new tab so sites send you to Google play store and they don't give you a chance to use them in desktop mode, New bugs especially in page organizing functions. If they fix all the recent bugs created in the past 2 months & had the ability to save websites to view later or open in the background like Firefox it would get 5 stars",1,0.9062,buggy as of feb  0 1  many sites don t work or the app freezes  took away desktop mode before you ask for a web page when adding a new tab so sites send you to google play store and they don t give you a chance to use them in desktop mode  new bugs especially in page organizing functions  if they fix all the recent bugs created in the past   months   had the ability to save websites to view later or open in the background like firefox it would get   stars
274,"Grouped tabs on a phone, I love having to squint to see what used to be easy to flip between. And no way to turn it off.",1,0.7096,grouped tabs on a phone  i love having to squint to see what used to be easy to flip between  and no way to turn it off 
275,My app has simply refused to update. I press the update button and it does nothing . So I guess injyst disable and use a different browser? Very sad because I live Chrome. But I've been unable to update for the past 4 devices.. what gives? Please help. Thanks,1,0.8202,my app has simply refused to update  i press the update button and it does nothing   so i guess injyst disable and use a different browser  very sad because i live chrome  but i ve been unable to update for the past   devices   what gives  please help  thanks
276,It keeps telling me I have an update but will not update no matter how many times I try and it is messing with my phone. Please fix this.,1,0.4646,it keeps telling me i have an update but will not update no matter how many times i try and it is messing with my phone  please fix this 
277,Absolutely nothing loads. I lost everything I was searching for and had saved. It force quits whenever I open it. I tried uninstalling the update and restarting and it's still garbage.,1,0.5806,absolutely nothing loads  i lost everything i was searching for and had saved  it force quits whenever i open it  i tried uninstalling the update and restarting and it s still garbage 
278,The update won't download to install despite several attempts with phone rebooting between attempts.,1,0.5719,the update won t download to install despite several attempts with phone rebooting between attempts 
279,"Nevermind my issue was not fixed with recent update; still reloads last page after starting a new search. The change to the tabs section is what's preventing 5, stars, like grouped tabs, are people gonna open like 6 groups of 10 tabs each with a different category? I just wish I could switch that back it's just useless and annoying but looks like I gotta switch browsers instead 🤷 opera here I come least there I don't have to see celebrity gossip labeled as ""news""",1,0.4118,nevermind my issue was not fixed with recent update  still reloads last page after starting a new search  the change to the tabs section is what s preventing    stars  like grouped tabs  are people gonna open like   groups of 10 tabs each with a different category  i just wish i could switch that back it s just useless and annoying but looks like i gotta switch browsers instead   opera here i come least there i don t have to see celebrity gossip labeled as  news 
280,Won't update on my note 10+ 5g,1,0.5719,won t update on my note 10   g
281,Went from amazing to garbage. After the last update it will no longer refresh or load any relevant news. Just a few repetitive junk news articles. Please fix this garbage update.,1,0.4404,went from amazing to garbage  after the last update it will no longer refresh or load any relevant news  just a few repetitive junk news articles  please fix this garbage update 
282,"Get rid of the tabs! Looks like the people at Google who design the GUI for the Chrome browser have never heard the saying, ""If it ain't broke don't fix it."" I was just fine with a list of tabs to flip through like it used to be up till a few days ago. I don't need mini views of each open page to remind me what I've been doing - I'm not an idiot - and I definitely don't need a piece of my screen real estate taken over to show me what tabs belong to the group. This is a ""feature"" no one needs.",1,0.7353,get rid of the tabs  looks like the people at google who design the gui for the chrome browser have never heard the saying   if it ain t broke don t fix it   i was just fine with a list of tabs to flip through like it used to be up till a few days ago  i don t need mini views of each open page to remind me what i ve been doing   i m not an idiot   and i definitely don t need a piece of my screen real estate taken over to show me what tabs belong to the group  this is a  feature  no one needs 
283,Nice app,1,0.4215,nice app
284,"Cannot update chrome, it just won't let me",1,0.5719,cannot update chrome  it just won t let me
285,I couldn't able to update my chrome from past 1 year.. please help,1,0.6124,i couldn t able to update my chrome from past 1 year   please help
286,Can't even update it what a lol kind of app!!,1,0.4215,can t even update it what a lol kind of app  
287,It won't allow me to update the app.....Why?,1,0.6808,it won t allow me to update the app     why 
288,Help,1,0.4019,help
289,Wont even install. Has been trying to install for days and continuously freezes. Pretty dissapointing.,1,0.4767,wont even install  has been trying to install for days and continuously freezes  pretty dissapointing 
290,Please add dark mode like samsung browser,1,0.5859,please add dark mode like samsung browser
291,"How to disable tab groups: Open Chrome Type, ""chrome://flags/"" Search, ""Tab Groups"" Disable results. Profit.",1,0.4404,how to disable tab groups  open chrome type   chrome   flags   search   tab groups  disable results  profit 
292,Awesome,1,0.6249,awesome
293,It won't load. ://,1,0.5719,it won t load     
294,This version is not getting updated on this Honor 10 device.,1,0.5789,this version is not getting updated on this honor 10 device 
295,Nice,1,0.4215,nice
296,"The recent update made it rubbish, I switched to another browser , but still have chrome in mobile either fix it or users like me will uninstall it",1,0.5023,the recent update made it rubbish  i switched to another browser   but still have chrome in mobile either fix it or users like me will uninstall it
297,Chrome is not update option so please tell me,1,0.4572,chrome is not update option so please tell me
298,Need improvement,1,0.4588,need improvement
299,Nice,1,0.4215,nice
300,"I specifically remember asking Google for help due to my information being stolen and I asked for a"" security key "" I ended up using the one that is built in to the phone, however when I had to factory so now I cannot get it to my Google account and reset it, I guess I reset the security key too ALL OF MY PERSONAL DATA AND INFORMATION IS IN THE ACCOUNT,, MY NAME AND SOCIAL SECURITY NUMBER ARE FLAGGED FOR IDENTITY THEFT, I'M SAYING THAT I WILL File a claim against Google ,",1,0.7184,i specifically remember asking google for help due to my information being stolen and i asked for a  security key   i ended up using the one that is built in to the phone  however when i had to factory so now i cannot get it to my google account and reset it  i guess i reset the security key too all of my personal data and information is in the account   my name and social security number are flagged for identity theft  i m saying that i will file a claim against google  
301,Heart of 6 mobile,1,0.6369,heart of   mobile
302,The app was working great until this recent update. It gets crashing nd the screen stops working in between while using this app. Google should look into it and resolve this ASAP. Not expected this kind of update from Google,1,0.7269,the app was working great until this recent update  it gets crashing nd the screen stops working in between while using this app  google should look into it and resolve this asap  not expected this kind of update from google
303,Ever since I got a notification about updating Chrome I push the update button trying to update it but it won't update anyone else having that problem like come on,1,0.6956,ever since i got a notification about updating chrome i push the update button trying to update it but it won t update anyone else having that problem like come on
304,"App won't update I clicked the update button and it goes to cancel.. n a month latter, it still won't update",1,0.7506,app won t update i clicked the update button and it goes to cancel   n a month latter  it still won t update
305,Good,1,0.4404,good
306,Good app,1,0.4404,good app
307,Its good,1,0.4404,its good
308,Won't update at all....I've tried all sorts of things and it just won't do it.,1,0.8126,won t update at all    i ve tried all sorts of things and it just won t do it 
309,Its stalled! Won't update!,1,0.4404,its stalled  won t update 
310,"Chrome is good, I trust this update will make it better.",1,0.8442,chrome is good  i trust this update will make it better 
