,Text,Star,Compound Value,Cleaned_Text
125,am trying to update on my one plus6 mobile bt it's not updating don't know y please solve this soon,1,0.4767,am trying to update on my one plus  mobile bt it s not updating don t know y please solve this soon
126,Again my chrome won't update.....garbage,1,0.5719,again my chrome won t update     garbage
127,good,1,0.4404,good
128,Why won't it update when it says it needs updated ?,1,0.5719,why won t it update when it says it needs updated  
129,It won't update no matter how much I try to make it. Even on other devices.,1,0.5612,it won t update no matter how much i try to make it  even on other devices 
130,"Won't let me update . I've uninstalled and tried to reinstall it. But it doesn't work. UPDATE: finally got it to update, now another update??? Still won't update UPDATE 1/17/21Still won't UPDATE",1,0.9253,won t let me update   i ve uninstalled and tried to reinstall it  but it doesn t work  update  finally got it to update  now another update    still won t update update 1 1   1still won t update
131,Plezz support Android 4.4.4,1,0.4019,plezz support android      
132,I can't update this app Plz help,1,0.4588,i can t update this app plz help
133,Can't wait for government to take you down lol,1,0.4215,can t wait for government to take you down lol
134,Won't download,1,0.5719,won t download
135,Won't update.,1,0.5719,won t update 
136,"I dont know what's happening right now but google isn't working at all for me, cant look anything up, the app closes and says that it's not working, so I thought maybe its because I havent updated it in like a million years, so I click the update button and it dosent work, I dont know what ti do right now?",1,0.5023,i dont know what s happening right now but google isn t working at all for me  cant look anything up  the app closes and says that it s not working  so i thought maybe its because i havent updated it in like a million years  so i click the update button and it dosent work  i dont know what ti do right now 
137,Google is better,1,0.4404,google is better
138,"Straight up won't update. Even has a notification in-app telling me to update, but it refuses to do it. Pixel 3a XL",1,0.4215,straight up won t update  even has a notification in app telling me to update  but it refuses to do it  pixel  a xl
139,I'm being stalked. HELP,1,0.4019,i m being stalked  help
140,From last 4 month i will be try to update this app but its not be done.... Shame on you,1,0.5157,from last   month i will be try to update this app but its not be done     shame on you
141,I am unable to update my app Kindly help me in this regard,1,0.7096,i am unable to update my app kindly help me in this regard
142,Nice,1,0.4215,nice
143,"so happy to say im finally getting rid of google chrome. it was difficult for a long time due to a lack of alternatives but the developers made it very easy to uninstall by making the browser more and more garbage and unusable, much appreciated, thank you <3!",1,0.9199,so happy to say im finally getting rid of google chrome  it was difficult for a long time due to a lack of alternatives but the developers made it very easy to uninstall by making the browser more and more garbage and unusable  much appreciated  thank you    
144,Better,1,0.4404,better
145,It keeps freezing and won't allow me to update,1,0.6369,it keeps freezing and won t allow me to update
146,"App won't update at all, tried restarting the phone numerous times as well as clearing all app data and it still won't update, browser is currently slow and cannot access some sites.",1,0.8591,app won t update at all  tried restarting the phone numerous times as well as clearing all app data and it still won t update  browser is currently slow and cannot access some sites 
147,I cant update my chrome from 19th jan 2020. Please help me out,1,0.6124,i cant update my chrome from 1 th jan  0 0  please help me out
148,Good,1,0.4404,good
149,Wonderful,1,0.5719,wonderful
150,Not updating Worst app,1,0.5096,not updating worst app
151,Past 4 days Google chrome is not working at all I don't know why it is happening please solve the issue,1,0.4767,past   days google chrome is not working at all i don t know why it is happening please solve the issue
152,Good,1,0.4404,good
153,Super,1,0.5994,super
154,Wonderful,1,0.5719,wonderful
155,Good,1,0.4404,good
156,Nice app i like this app,1,0.6486,nice app i like this app
157,The app refuses to update. When I try to force update it cancels the update. If I need to start using another browser I will but hopefully this gets fixed soon.,1,0.4767,the app refuses to update  when i try to force update it cancels the update  if i need to start using another browser i will but hopefully this gets fixed soon 
158,It has a virus on it and now it has the virus on my phone. Hopefully this will be fixed fast.,1,0.4019,it has a virus on it and now it has the virus on my phone  hopefully this will be fixed fast 
159,Not bad,1,0.431,not bad
160,Won't update on new phones . Galaxy surplus,1,0.5719,won t update on new phones   galaxy surplus
161,"Please bring back the scrollable tabs because it was an easy and quick way to choose a tab no matter if there were 5 or 50. Also, please make life unbearable for all the idiots who decided to change it. Thank you",1,0.8371,please bring back the scrollable tabs because it was an easy and quick way to choose a tab no matter if there were   or  0  also  please make life unbearable for all the idiots who decided to change it  thank you
162,[Jan 28.21 still won't update] Unable to update since November 2020; starts to download then does nothing.,1,0.5719, jan     1 still won t update  unable to update since november  0 0  starts to download then does nothing 
163,Nice,1,0.4215,nice
164,I couldn't update resent update I don't know please help me for that,1,0.5106,i couldn t update resent update i don t know please help me for that
165,I'm trying to update it but it won't let me and I can't use Chrome because it won't let me do anything,1,0.9022,i m trying to update it but it won t let me and i can t use chrome because it won t let me do anything
166,Google steals data and now is starting to become the enemy of the County by manipulate data to benefit China and other countries that align against the US. Brave and other secure browsers are better.,1,0.5994,google steals data and now is starting to become the enemy of the county by manipulate data to benefit china and other countries that align against the us  brave and other secure browsers are better 
167,L'application est a jour mais ne veut pas fonctionner correctement,1,0.4588,l application est a jour mais ne veut pas fonctionner correctement
168,"The app always request me to update it...but when I try to update it doesn't update as normal as other applications,please try to solve this issue.",1,0.631,the app always request me to update it   but when i try to update it doesn t update as normal as other applications please try to solve this issue 
169,Very Heavyweight and battery draining app taking 3.2 GB space. Also this app cannot be moved to the SD card so that some space could have been saved from the phone memory.,1,0.4215,very heavyweight and battery draining app taking     gb space  also this app cannot be moved to the sd card so that some space could have been saved from the phone memory 
170,"Been trying to update this fir a month now, but it isn't successful.",1,0.7351,been trying to update this fir a month now  but it isn t successful 
171,I can not update Google Chrome please help me to solve this issue,1,0.7003,i can not update google chrome please help me to solve this issue
172,Won't update,1,0.5719,won t update
173,Won't update,1,0.5719,won t update
174,"Won't update, period.....",1,0.5719,won t update  period     
175,"nice,✨",1,0.4215,nice  
176,"Dear developer ..... I can't update Google chrome.....so, I think you must be solve this issue as soon as possible...",1,0.5267,dear developer       i can t update google chrome     so  i think you must be solve this issue as soon as possible   
177,app keeps crashing and i cant update it. going to look for a better browser,1,0.4404,app keeps crashing and i cant update it  going to look for a better browser
178,Won't download.,1,0.5719,won t download 
179,Didn't help at all. It's too complicated and doesn't work well for me. Uninstalled it as used too much space for nothing,1,0.5859,didn t help at all  it s too complicated and doesn t work well for me  uninstalled it as used too much space for nothing
180,Good,1,0.4404,good
181,Not updating.... Worst day by day,1,0.5096,not updating     worst day by day
182,Excellent,1,0.5719,excellent
183,Awesome,1,0.6249,awesome
184,Not updated my app google help me,1,0.4019,not updated my app google help me
185,I keep tapping update and it won't update,1,0.5719,i keep tapping update and it won t update
186,its so fuccing helpful,1,0.4728,its so fuccing helpful
187,Good,1,0.4404,good
188,Good luck with,1,0.7096,good luck with
189,"Doesn't update, vulnerable to cyber flaws, poor security, transfer your history, exposes your searches to hackers, essentially every internet search engine is vulnerable, likely a religious group. Even though the search is secure, if people don't like you, or what you are viewing online, hackers essentially just break the law and think they can black mail a person or businesses, identify theft happens, due to hackers. I would suggest checking to make sure dish networks are secure.",1,0.5574,doesn t update  vulnerable to cyber flaws  poor security  transfer your history  exposes your searches to hackers  essentially every internet search engine is vulnerable  likely a religious group  even though the search is secure  if people don t like you  or what you are viewing online  hackers essentially just break the law and think they can black mail a person or businesses  identify theft happens  due to hackers  i would suggest checking to make sure dish networks are secure 
190,"Still regressing. The discovery articles are trash, again. Still can't swipe away, now get suggestions that sometimes a year old, and now there's not even a more option at the bottom or anyway to refresh them. Thanks dumbasses",1,0.4404,still regressing  the discovery articles are trash  again  still can t swipe away  now get suggestions that sometimes a year old  and now there s not even a more option at the bottom or anyway to refresh them  thanks dumbasses
191,It just won't update no matter what I do like it will not download the updates at all,1,0.7291,it just won t update no matter what i do like it will not download the updates at all
192,The App very good,1,0.4927,the app very good
193,good app,1,0.4404,good app
194,Won't open for me anymore,1,0.5719,won t open for me anymore
195,Won't update on my new oppo a93,1,0.5719,won t update on my new oppo a  
196,don't like a new update at alllllll please change it back to old one,1,0.5859,don t like a new update at alllllll please change it back to old one
197,Please Google remove your update why are you giving updates while update not working..,1,0.5719,please google remove your update why are you giving updates while update not working  
198,Won't update,1,0.5719,won t update
199,😄😃☺😉😁😌 Good Luck To U 🎄,1,0.7096,       good luck to u  
200,Won't update,1,0.5719,won t update
201,"Won't update bc System Web-view won't update is my view,or something to do with Android 11 UI 3.5 on Samsung Tab S7",1,0.8126,won t update bc system web view won t update is my view or something to do with android 11 ui     on samsung tab s 
202,4th Feb update 😖☠ i liked that grouping tab and all. If there are some changes there should be a way to enable disable features☠,1,0.4215, th feb update    i liked that grouping tab and all  if there are some changes there should be a way to enable disable features 
203,"Why the phuck can I not go to bookmarks anymore, this app is becoming a laughing stock",1,0.4939,why the phuck can i not go to bookmarks anymore  this app is becoming a laughing stock
204,I can't updated this app pls help us,1,0.4588,i can t updated this app pls help us
205,Free mb,1,0.5106,free mb
206,Best,1,0.6369,best
207,"I am happy with the simplicity of this app, but it trakes and keeps all user's data. And now, I don't know why but I am unable to update the app using Google Play Store. Please try fixing this bug as earliest of possible and let user have some privacy and don't play with users' centiments.",1,0.8885,i am happy with the simplicity of this app  but it trakes and keeps all user s data  and now  i don t know why but i am unable to update the app using google play store  please try fixing this bug as earliest of possible and let user have some privacy and don t play with users  centiments 
208,"Does not update, Galaxy S20 FE. It would be nice if the update was properly tested before it is placed for users to use. Otherwise, I started to think that we get one more mICROSOFT instead of Google",1,0.4215,does not update  galaxy s 0 fe  it would be nice if the update was properly tested before it is placed for users to use  otherwise  i started to think that we get one more microsoft instead of google
209,This page uses too much memory so chrome removed some content Annoying more than useful ease fix it,1,0.501,this page uses too much memory so chrome removed some content annoying more than useful ease fix it
210,Won't update,1,0.5719,won t update
211,Guys pls developers help me my chrome is not working and my Google too. Its bot getting updated and also not doing any searches only blank pages,1,0.4588,guys pls developers help me my chrome is not working and my google too  its bot getting updated and also not doing any searches only blank pages
212,It's complicated...on purpose I'm sure ....a little awareness as to where we ought to be setting our phones would be very much appreciated?!,1,0.7076,it s complicated   on purpose i m sure     a little awareness as to where we ought to be setting our phones would be very much appreciated  
213,Can't get in app won't let me log,1,0.5719,can t get in app won t let me log
214,Won't update via Google Play. Thought issue was specific to Huawei phones but it's also the same for my samsung s21 ultra...,1,0.4678,won t update via google play  thought issue was specific to huawei phones but it s also the same for my samsung s 1 ultra   
215,"I want to update this app but that's didn't happen, I have infinix hot 9 pro mobile, please how to update this app, tell me",1,0.4767,i want to update this app but that s didn t happen  i have infinix hot   pro mobile  please how to update this app  tell me
216,Good,1,0.4404,good
217,Not updating.. How can i solve this issues please help🙏,1,0.7003,not updating   how can i solve this issues please help 
218,Any page that found that may help when I open the page it's a sorry this page cannot be Found. Not a lot of help,1,0.6249,any page that found that may help when i open the page it s a sorry this page cannot be found  not a lot of help
219,Won't download,1,0.5719,won t download
220,Super,1,0.5994,super
221,I don't like grouping of cards. I switched it off with the flags but it turns itself on again. Let me decide for myself what I like.,1,0.6124,i don t like grouping of cards  i switched it off with the flags but it turns itself on again  let me decide for myself what i like 
222,Its not updating....i try 1000 times...help,1,0.4019,its not updating    i try 1000 times   help
223,New update is super annoying with recent tabs. Please give an option for both. A tab within a tab? Tabception. Uninstalling and getting the old version. This is garbage and not user friendly in the least bit. Amazing that a multi billion dollar company put this out,1,0.688,new update is super annoying with recent tabs  please give an option for both  a tab within a tab  tabception  uninstalling and getting the old version  this is garbage and not user friendly in the least bit  amazing that a multi billion dollar company put this out
224,Nice,1,0.4215,nice
225,Releasing date update show date is different (ex - 4 February release but play store show 10 February ) very 😠😡😡,1,0.4767,releasing date update show date is different  ex     february release but play store show 10 february   very    
226,Won't update/download last few days,1,0.5719,won t update download last few days
227,I am unable to update the chrome kindly look into it and help me sorting out this,1,0.7096,i am unable to update the chrome kindly look into it and help me sorting out this
228,Not liking this application at all it won't update been trying for the last couple of months to update it and it won't probably going to find something else,1,0.7304,not liking this application at all it won t update been trying for the last couple of months to update it and it won t probably going to find something else
229,This app not updating on my phone. So tell me that how I am updating this app .. Thanks,1,0.4404,this app not updating on my phone  so tell me that how i am updating this app    thanks
230,Won't update.,1,0.5719,won t update 
231,Thise app good and i love it but i gave 1star because when i download any movie it take many time.,1,0.5499,thise app good and i love it but i gave 1star because when i download any movie it take many time 
232,Takes 5 ever but it's having help right L S,1,0.8201,takes   ever but it s having help right l s
233,"New update, but won't let me update",1,0.7227,new update  but won t let me update
234,Super,1,0.5994,super
235,If I update a chrome its updated but I open and use chrome it asking me to update but I updated the chrome I using chrome in samsung tablet version 4.1.2 please solve my issue please my tab samsung tab 3,1,0.7964,if i update a chrome its updated but i open and use chrome it asking me to update but i updated the chrome i using chrome in samsung tablet version   1   please solve my issue please my tab samsung tab  
236,good,1,0.4404,good
237,Always freezes and I don't support those who need with free speech,1,0.7096,always freezes and i don t support those who need with free speech
238,Bilkul bakar ha apps bhout jaldi ya apps hank karne lagta ha aoor ubdate Kar rha hu to ubdate bhi nhi ho rha ha,1,0.7351,bilkul bakar ha apps bhout jaldi ya apps hank karne lagta ha aoor ubdate kar rha hu to ubdate bhi nhi ho rha ha
239,Nice app for us guys 2,1,0.4215,nice app for us guys  
240,I might have given it a higher rating but it won't install so for now I will live with the update needed notification,1,0.7227,i might have given it a higher rating but it won t install so for now i will live with the update needed notification
241,Very useful for me keep using guys good app !!!,1,0.7264,very useful for me keep using guys good app    
242,Keep saying update but won't,1,0.7227,keep saying update but won t
243,Better,1,0.4404,better
244,It is very nice application the application developer unless you delete them,1,0.4754,it is very nice application the application developer unless you delete them
245,"This was good but the newest update makes way harder to navigate. By like why did you remove the ""open in new tab"" it was so useful and now these groups make it harder to browse.",1,0.8837,this was good but the newest update makes way harder to navigate  by like why did you remove the  open in new tab  it was so useful and now these groups make it harder to browse 
246,Not working. Worst update for mobile devices,1,0.5096,not working  worst update for mobile devices
247,Thanks Best Western Union Bank LTD for you and broth and Jell-O salad for lunch tomorrow,1,0.7964,thanks best western union bank ltd for you and broth and jell o salad for lunch tomorrow
248,Good,1,0.4404,good
249,"I don't like how the tab screen is organized with the new update. I don't like how it's a double column compared to the previous one column and when I rotate the screen to see if it does go back to one, I come across having three columns. I don't like that it forces you to make a new tab that you open into a group that in order to get rid of you have to go to the tab screen and manually do it yourself. When you do undo it, you loose the new tab in all your other tabs.",1,0.6369,i don t like how the tab screen is organized with the new update  i don t like how it s a double column compared to the previous one column and when i rotate the screen to see if it does go back to one  i come across having three columns  i don t like that it forces you to make a new tab that you open into a group that in order to get rid of you have to go to the tab screen and manually do it yourself  when you do undo it  you loose the new tab in all your other tabs 
250,Chrome won't update . 🤬,1,0.5719,chrome won t update    
251,"I don't like the grouping feature. If I want to open a link from a pre-existing tab the only options I get is to group the tab or open in incognito. The little tab at the bottom that pops up if you do decide to group your tabs is also annoying, as I don't like it when things take up space. Please fix, thanks.",1,0.7783,i don t like the grouping feature  if i want to open a link from a pre existing tab the only options i get is to group the tab or open in incognito  the little tab at the bottom that pops up if you do decide to group your tabs is also annoying  as i don t like it when things take up space  please fix  thanks 
252,Card view was much better! I definitely need it to be returned,1,0.6808,card view was much better  i definitely need it to be returned
253,I can't update it plz help me out,1,0.4588,i can t update it plz help me out
254,I can't able to update my Google chrome please I need help asap,1,0.6124,i can t able to update my google chrome please i need help asap
255,Very good,1,0.4927,very good
256,You sent me a corrupt email by linking it to my new third phone and I lost my internet. Can't make calls. It's dropping calls more now so I know I am about to loss another phone. I have repeatedly asked you for help. Erasing my email won't fix it either. Because I have tried. I have bought three phones only to have you send me link to to a hacker. Plus they got into my bank. Thanks.,1,0.6908,you sent me a corrupt email by linking it to my new third phone and i lost my internet  can t make calls  it s dropping calls more now so i know i am about to loss another phone  i have repeatedly asked you for help  erasing my email won t fix it either  because i have tried  i have bought three phones only to have you send me link to to a hacker  plus they got into my bank  thanks 
257,Good,1,0.4404,good
258,Won't update,1,0.5719,won t update
259,Won't updating why?,1,0.5719,won t updating why 
260,Previous version was much better,1,0.4404,previous version was much better
261,App won't update,1,0.5719,app won t update
262,"Won't UPDATE, WHY NOT???",1,0.5719,won t update  why not   
263,good,1,0.4404,good
264,I have looked out on my phone as a security I came with the phone and it came up and gave me a red flag saying that Chrome is a vulnerability fix immediately it's the only one that said that about so I'm deleting my Chrome I'm using brave now,1,0.5994,i have looked out on my phone as a security i came with the phone and it came up and gave me a red flag saying that chrome is a vulnerability fix immediately it s the only one that said that about so i m deleting my chrome i m using brave now
265,Man o man am I ever glad I didn't update this app . After reading the reviews I have realized it would not be a good idea to update it. So for now I'm going to stick with the previous version. One would assume that the smart people at Google would do a bit more research before fixing something that isn't broke. For the most part Google has been pretty good for me so I hope the next update will be a little more thought out and have a lot more positive reviews because this one had practically none,1,0.9282,man o man am i ever glad i didn t update this app   after reading the reviews i have realized it would not be a good idea to update it  so for now i m going to stick with the previous version  one would assume that the smart people at google would do a bit more research before fixing something that isn t broke  for the most part google has been pretty good for me so i hope the next update will be a little more thought out and have a lot more positive reviews because this one had practically none
266,Very nice 👌👌😊👌👌👌👌👌👌👌👌👌👌👌👌 you have you,1,0.4754,very nice                 you have you
267,"I don't know why there is a need to update a thing that's worling totally fine. I am on a tablet and the chrome works really bad after the update. I got a tip for those who *accidently* updated chrome. Uninstall it and then don't update again And for the people with pc browser, use Brave browser, it is really nice working browser better than chrome nowadays. (No promo) And this is for the devs,🖕",1,0.6697,i don t know why there is a need to update a thing that s worling totally fine  i am on a tablet and the chrome works really bad after the update  i got a tip for those who  accidently  updated chrome  uninstall it and then don t update again and for the people with pc browser  use brave browser  it is really nice working browser better than chrome nowadays   no promo  and this is for the devs  
268,Whoever approved the new UI changes definitely forgot to check UX. 0 rating on the New UX.,1,0.6705,whoever approved the new ui changes definitely forgot to check ux  0 rating on the new ux 
269,Google is always safe,1,0.4404,google is always safe
270,It won't update,1,0.5719,it won t update
